<?xml version="1.0" encoding="UTF-8"?>
<matrix xmlns="https://github.com/tddl/tddl/schema/matrix" xmlns:xsi="http://www.w3.org/2001/XMLSchema-instance"
    xsi:schemaLocation="https://github.com/tddl/tddl/schema/matrix https://raw.github.com/tddl/tddl/master/tddl-common/src/main/resources/META-INF/matrix.xsd">
    
    <appName>test_matrix</appName>
    
	<group name="andor_group_0" type="MYSQL_JDBC">
	</group>

	<group name="andor_group_1" type="MYSQL_JDBC">
	</group>
	
	<!-- hbase group -->
	<group name="andor_hbase_group" type="HBASE_CLIENT">
		<properties>
			<property name="mysql_groupName">
				<value>andor_hbase_group</value>
			</property>
			<property name="mysql_appName" value="andor_hbase_qatest" />
			<property name="hbase.zookeeper.quorum" value="10.20.144.51" />
			<property name="hbase.zookeeper.property.clientPort" value="2181" />
			<property name="zookeeper.znode.parent" value="/hbase_tesla" />
		</properties>
	</group>

	<group name="andor_hbase_group2" type="HBASE_CLIENT">
		<properties>
			<property name="mysql_groupName" value="andor_hbase_group2" />
			<property name="mysql_appName" value="andor_hbase_qatest" />
			<property name="hbase.zookeeper.quorum" value="10.232.98.74,10.232.98.75,10.232.98.76,10.232.98.77,10.232.98.7" />
			<property name="hbase.zookeeper.property.clientPort" value="2181" />
			<property name="zookeeper.znode.parent" value="/hbase-rd-test-0.94" />
		</properties>
	</group>
</matrix>