<?xml version="1.0" encoding="UTF-8"?>
<matrix xmlns="https://github.com/tddl/tddl/schema/matrix"
	xmlns:xsi="http://www.w3.org/2001/XMLSchema-instance"
	xsi:schemaLocation="https://github.com/tddl/tddl/schema/matrix https://raw.github.com/tddl/tddl/master/tddl-common/src/main/resources/META-INF/matrix.xsd">

	<appName>andor_show</appName>
	<group name="andor_show_group0" type="MYSQL_JDBC">
		<properties>
			<property name="com.taobao.tddl.jdbc.group_V2.4.1_andor_show_group0">
				<value>andor_show_group0_atom0:r10w10p0</value>
			</property>
		</properties>

		<atom name="andor_show_group0_atom0">
			<properties>
				<property name="com.taobao.tddl.atom.global.andor_show_group0_atom0">
					<value>
					ip=10.232.31.21
					port=3306
					dbName=andor_show
					dbType=mysql
					dbStatus=RW
				</value>
				</property>
				<property
					name="com.taobao.tddl.atom.app.andor_show.andor_show_group0_atom0">
					<value>
					userName=andor
					minPoolSize=20
					maxPoolSize=40
					idleTimeout=20
					blockingTimeout=10000
					preparedStatementCacheSize=1000
					connectionProperties=characterEncoding=gbk;autoReconnect=true
					readRestrictTimes=0
					writeRestrictTimes=0
					timeSliceInMillis=0
				</value>
				</property>

				<property name="com.taobao.tddl.atom.passwd.andor_show.mysql.andor">
					<value>encPasswd=andor</value>
				</property>
			</properties>
		</atom>

		<atom name="">
		</atom>

		<atom name="">
		</atom>
	</group>


	<group name="andor_show_group1" type="MYSQL_JDBC">
	</group>

	<group name="ob_group" type="OCEANBASE_JDBC">
		<properties>
			<property name="CONFIGURL">
				<value>http://obconsole.test.alibaba-inc.com/ob-config/config.co?dataId=wireless_message</value>
			</property>
		</properties>
	</group>
</matrix>